<?xml version="1.0"?>
<xs:schema xmlns:xs="http://www.w3.org/2001/XMLSchema">
<xs:element name="students">
  <xs:complexType>
    <xs:sequence>
      <xs:element name="student" maxOccurs="unbounded">
        <xs:complexType>       
		<xs:attribute name="nr_matr" type="xs:integer" use="required"/>
		<xs:attribute name="nume" type="xs:string" use="required"/>
    <xs:attribute name="medie" type="xs:double" use="required"/>
        </xs:complexType>
      </xs:element>
    </xs:sequence>
  </xs:complexType>
</xs:element>
</xs:schema>